slug,title,description
v-nalichii-i-pod-zakaz,В наличии и под заказ,Основные виды рыбы для зарыбления пруда: мальки и взрослые особи в наличии и под заказ с доставкой по России.
osetrovye-porody,Осетровые породы,"Премиальные осетровые виды для товарного выращивания, зарыбления частных водоёмов и платной рыбалки."
lososevye-porody,Лососевые породы,"Лососевые виды для прудов и хозяйств: стабильный спрос, высокая пищевая ценность и эффектная подача в рыбалке."
hishchnye-porody,Хищные породы,"Хищные виды для контроля популяции, баланса экосистемы и спортивной рыбалки в частных и коммерческих прудах."
dekorativnye-ryby,Декоративные рыбы,"Декоративные рыбы для ландшафтных и частных прудов: яркий внешний вид, разнообразие форм и стабильное поведение."
prochee,Прочее,"Сопутствующие позиции для экосистемы пруда: моллюски, раки и другие виды для поддержания биологического баланса."
